{
  "name": "emergency-guard",
  "description": "Step 3's emergency rule and its guard of D33: queue_ms above 1500 steps down two rungs with decimation 2 at t_ms 200, and fires again only 600 ms after that downshift, at 800, reaching rung 4.",
  "profile": "webcodecs",
  "ladder": [
    {
      "rung": 0,
      "w": 480,
      "h": 640,
      "fps": 20,
      "video_kbps": 900,
      "audio_kbps": 24
    },
    {
      "rung": 1,
      "w": 480,
      "h": 640,
      "fps": 20,
      "video_kbps": 600,
      "audio_kbps": 24
    },
    {
      "rung": 2,
      "w": 480,
      "h": 640,
      "fps": 15,
      "video_kbps": 400,
      "audio_kbps": 24
    },
    {
      "rung": 3,
      "w": 336,
      "h": 448,
      "fps": 12,
      "video_kbps": 250,
      "audio_kbps": 16
    },
    {
      "rung": 4,
      "w": 288,
      "h": 384,
      "fps": 10,
      "video_kbps": 150,
      "audio_kbps": 12
    }
  ],
  "start_rung": 0,
  "ticks": [
    {
      "t_ms": 200,
      "queued_bytes": 160000,
      "drained_bytes_1s": 100000,
      "encoded_kbps_2s": 924
    },
    {
      "t_ms": 400,
      "queued_bytes": 160000,
      "drained_bytes_1s": 100000,
      "encoded_kbps_2s": 924
    },
    {
      "t_ms": 600,
      "queued_bytes": 160000,
      "drained_bytes_1s": 100000,
      "encoded_kbps_2s": 924
    },
    {
      "t_ms": 800,
      "queued_bytes": 160000,
      "drained_bytes_1s": 100000,
      "encoded_kbps_2s": 924
    },
    {
      "t_ms": 1000,
      "queued_bytes": 30000,
      "drained_bytes_1s": 100000,
      "encoded_kbps_2s": 162
    },
    {
      "t_ms": 1200,
      "queued_bytes": 30000,
      "drained_bytes_1s": 100000,
      "encoded_kbps_2s": 162
    },
    {
      "t_ms": 1400,
      "queued_bytes": 30000,
      "drained_bytes_1s": 100000,
      "encoded_kbps_2s": 162
    }
  ],
  "pings": [],
  "set_rung": [],
  "keyframe_requests": [],
  "idrs": [],
  "expect": {
    "rungs": [
      {
        "t_ms": 200,
        "rung": 2,
        "reason": "backpressure"
      },
      {
        "t_ms": 800,
        "rung": 4,
        "reason": "backpressure"
      }
    ],
    "decimation": [
      {
        "t_ms": 200,
        "decimation": 2
      }
    ],
    "floor_tick": null
  }
}
