{
  "name": "keyframe-skip",
  "description": "Step 2: a tick within 300 ms of a keyframe request is skipped and holds every count. The request at t_ms 850 skips the tick at 1000, so queue_ms above 600 reaches its second tick at 1200, which steps down to rung 3; the one at 1990 skips the ticks at 2000 and 2200, so the emergency rule waits for 2400 and steps down to rung 4; the one at 3050 skips the tick at 3200, so the floor breaches on the 16th tick after the step, at 5600.",
  "profile": "webcodecs",
  "ladder": [
    {
      "rung": 0,
      "w": 480,
      "h": 640,
      "fps": 20,
      "video_kbps": 900,
      "audio_kbps": 24
    },
    {
      "rung": 1,
      "w": 480,
      "h": 640,
      "fps": 20,
      "video_kbps": 600,
      "audio_kbps": 24
    },
    {
      "rung": 2,
      "w": 480,
      "h": 640,
      "fps": 15,
      "video_kbps": 400,
      "audio_kbps": 24
    },
    {
      "rung": 3,
      "w": 336,
      "h": 448,
      "fps": 12,
      "video_kbps": 250,
      "audio_kbps": 16
    },
    {
      "rung": 4,
      "w": 288,
      "h": 384,
      "fps": 10,
      "video_kbps": 150,
      "audio_kbps": 12
    }
  ],
  "start_rung": 2,
  "ticks": [
    {
      "t_ms": 200,
      "queued_bytes": 15000,
      "drained_bytes_1s": 50000,
      "encoded_kbps_2s": 424
    },
    {
      "t_ms": 400,
      "queued_bytes": 15000,
      "drained_bytes_1s": 50000,
      "encoded_kbps_2s": 424
    },
    {
      "t_ms": 600,
      "queued_bytes": 15000,
      "drained_bytes_1s": 50000,
      "encoded_kbps_2s": 424
    },
    {
      "t_ms": 800,
      "queued_bytes": 35000,
      "drained_bytes_1s": 50000,
      "encoded_kbps_2s": 424
    },
    {
      "t_ms": 1000,
      "queued_bytes": 35000,
      "drained_bytes_1s": 50000,
      "encoded_kbps_2s": 424
    },
    {
      "t_ms": 1200,
      "queued_bytes": 35000,
      "drained_bytes_1s": 50000,
      "encoded_kbps_2s": 424
    },
    {
      "t_ms": 1400,
      "queued_bytes": 15000,
      "drained_bytes_1s": 50000,
      "encoded_kbps_2s": 266
    },
    {
      "t_ms": 1600,
      "queued_bytes": 15000,
      "drained_bytes_1s": 50000,
      "encoded_kbps_2s": 266
    },
    {
      "t_ms": 1800,
      "queued_bytes": 15000,
      "drained_bytes_1s": 50000,
      "encoded_kbps_2s": 266
    },
    {
      "t_ms": 2000,
      "queued_bytes": 80000,
      "drained_bytes_1s": 50000,
      "encoded_kbps_2s": 266
    },
    {
      "t_ms": 2200,
      "queued_bytes": 80000,
      "drained_bytes_1s": 50000,
      "encoded_kbps_2s": 266
    },
    {
      "t_ms": 2400,
      "queued_bytes": 80000,
      "drained_bytes_1s": 50000,
      "encoded_kbps_2s": 266
    },
    {
      "t_ms": 2600,
      "queued_bytes": 100000,
      "drained_bytes_1s": 50000,
      "encoded_kbps_2s": 162
    },
    {
      "t_ms": 2800,
      "queued_bytes": 100000,
      "drained_bytes_1s": 50000,
      "encoded_kbps_2s": 162
    },
    {
      "t_ms": 3000,
      "queued_bytes": 100000,
      "drained_bytes_1s": 50000,
      "encoded_kbps_2s": 162
    },
    {
      "t_ms": 3200,
      "queued_bytes": 100000,
      "drained_bytes_1s": 50000,
      "encoded_kbps_2s": 162
    },
    {
      "t_ms": 3400,
      "queued_bytes": 100000,
      "drained_bytes_1s": 50000,
      "encoded_kbps_2s": 162
    },
    {
      "t_ms": 3600,
      "queued_bytes": 100000,
      "drained_bytes_1s": 50000,
      "encoded_kbps_2s": 162
    },
    {
      "t_ms": 3800,
      "queued_bytes": 100000,
      "drained_bytes_1s": 50000,
      "encoded_kbps_2s": 162
    },
    {
      "t_ms": 4000,
      "queued_bytes": 100000,
      "drained_bytes_1s": 50000,
      "encoded_kbps_2s": 162
    },
    {
      "t_ms": 4200,
      "queued_bytes": 100000,
      "drained_bytes_1s": 50000,
      "encoded_kbps_2s": 162
    },
    {
      "t_ms": 4400,
      "queued_bytes": 100000,
      "drained_bytes_1s": 50000,
      "encoded_kbps_2s": 162
    },
    {
      "t_ms": 4600,
      "queued_bytes": 100000,
      "drained_bytes_1s": 50000,
      "encoded_kbps_2s": 162
    },
    {
      "t_ms": 4800,
      "queued_bytes": 100000,
      "drained_bytes_1s": 50000,
      "encoded_kbps_2s": 162
    },
    {
      "t_ms": 5000,
      "queued_bytes": 100000,
      "drained_bytes_1s": 50000,
      "encoded_kbps_2s": 162
    },
    {
      "t_ms": 5200,
      "queued_bytes": 100000,
      "drained_bytes_1s": 50000,
      "encoded_kbps_2s": 162
    },
    {
      "t_ms": 5400,
      "queued_bytes": 100000,
      "drained_bytes_1s": 50000,
      "encoded_kbps_2s": 162
    },
    {
      "t_ms": 5600,
      "queued_bytes": 100000,
      "drained_bytes_1s": 50000,
      "encoded_kbps_2s": 162
    }
  ],
  "pings": [],
  "set_rung": [],
  "keyframe_requests": [
    {
      "t_ms": 850
    },
    {
      "t_ms": 1990
    },
    {
      "t_ms": 3050
    }
  ],
  "idrs": [
    {
      "t_ms": 900
    },
    {
      "t_ms": 2040
    },
    {
      "t_ms": 3150
    }
  ],
  "expect": {
    "rungs": [
      {
        "t_ms": 1200,
        "rung": 3,
        "reason": "backpressure"
      },
      {
        "t_ms": 2400,
        "rung": 4,
        "reason": "backpressure"
      }
    ],
    "decimation": [
      {
        "t_ms": 1200,
        "decimation": 1
      },
      {
        "t_ms": 2400,
        "decimation": 2
      }
    ],
    "floor_tick": 5600
  }
}
